name,description,url,logo_url,categories,domains,cost_index,bench_score,embedding_text
"GPT-5","가장 진보된 언어 모델로 수학, 코딩, 복잡한 추론에서 최고 수준의 성능을 제공하는 범용 AI","https://openai.com/chatgpt","https://www.google.com/s2/favicons?domain=openai.com&sz=128","콘텐츠 생성, 코딩 지원, 데이터 분석","이메일 초안 작성, 보고서 요약, 코드 생성, 창작 지원",1,98,"OpenAI GPT-5는 2025년 8월 출시된 가장 진보된 언어 모델로, AIME 2025에서 94.6%의 수학 성취도와 SWE-bench Verified에서 74.9%의 코딩 성능을 달성했다. 이전 모델 대비 환각 현상이 크게 줄어들었으며, 복잡한 추론과 창의적 작업에서 인간 수준에 근접한 성능을 보여준다. 무료 사용자도 무제한 접근이 가능하며 유료 사용자는 더 높은 수준의 지능을 활용할 수 있다. 비즈니스 글쓰기, 학술 연구, 소프트웨어 개발, 창작 활동 등 광범위한 지적 작업에서 인간의 노력을 극적으로 줄여주는 핵심 도구이다."
"Claude 4.1 Opus","고도의 안전성과 복잡한 추론 능력을 갖춘 Anthropic의 최신 플래그십 AI 모델","https://www.anthropic.com/claude","https://www.google.com/s2/favicons?domain=anthropic.com&sz=128","콘텐츠 생성, 코딩 지원, 분석","학술 연구, 법률 문서 분석, 복잡한 코드 리뷰, 전략 분석",2,95,"Anthropic Claude 4.1 Opus는 2025년 8월 출시된 최신 플래그십 모델로, Level 3 안전성 등급을 받을 정도로 강력한 능력을 인정받았다. Constitutional AI와 RLHF 훈련을 통해 높은 윤리적 기준을 유지하면서도 복잡한 추론과 분석 작업에서 탁월한 성능을 보인다. 특히 법률, 의료, 학술 연구 등 고도의 전문성과 정확성이 요구되는 분야에서 신뢰할 수 있는 결과를 제공한다. API, Claude 앱, GitHub Copilot 등 다양한 플랫폼에서 접근 가능하며, 긴 문서 분석과 복잡한 다단계 추론이 필요한 전문가 수준의 작업에 최적화되어 있다."
"Claude 3.5 Sonnet","속도와 성능의 균형을 맞춘 범용 AI 모델로 코딩과 시각적 추론에 특화","https://www.anthropic.com/claude","https://www.google.com/s2/favicons?domain=anthropic.com&sz=128","콘텐츠 생성, 코딩 지원, 이미지 분석","웹 개발, 차트 해석, 텍스트 추출, 멀티스텝 워크플로우",1,88,"Claude 3.5 Sonnet은 Claude 3 Opus보다 2배 빠른 속도로 작동하면서도 동등하거나 더 나은 성능을 제공하는 중급 모델이다. 코딩 평가에서 64%의 문제 해결률을 달성하며, 특히 시각적 추론, 차트 해석, 이미지에서의 텍스트 추출에서 강점을 보인다. Artifacts 기능을 통해 실시간으로 코드와 콘텐츠를 생성하고 편집할 수 있어 협업적 작업 환경을 제공한다. 컴퓨터 사용(computer use) 기능으로 데스크톱 환경에서 직접 작업을 수행할 수 있으며, 일반적인 비즈니스 업무와 개발 작업에서 비용 효율적인 선택지로 평가받는다."
"Gemini 2.5 Pro","Google의 최고 수준 추론 모델로 코딩, 수학, STEM 분야의 복잡한 문제 해결에 특화","https://gemini.google.com","https://www.google.com/s2/favicons?domain=google.com&sz=128","코딩 지원, 데이터 분석, 과학 연구","소프트웨어 개발, 데이터 사이언스, 학술 연구, 대규모 문서 분석",2,93,"Google Gemini 2.5 Pro는 사고(thinking) 모델로 설계된 최고 수준의 추론 능력을 갖춘 플래그십 모델이다. WebDev Arena에서 ELO 1420점으로 1위를 기록했으며, 100만 토큰의 컨텍스트 윈도우로 긴 문서와 대규모 코드베이스 분석이 가능하다. 코딩 벤치마크에서 최고 점수를 기록했고, 복잡한 수학과 STEM 문제 해결에서 탁월한 성능을 보인다. PDF, 오디오, 비디오, 이미지 등 다양한 형태의 입력을 처리할 수 있으며, 특히 대규모 데이터셋과 복잡한 코드베이스를 다루는 전문가들에게 이상적인 도구이다. 비용보다는 최고 품질의 결과물이 필요한 미션 크리티컬한 작업에 적합하다."
"Gemini 2.5 Flash","속도와 비용 효율성에 최적화된 Google의 경량 AI 모델","https://gemini.google.com","https://www.google.com/s2/favicons?domain=google.com&sz=128","콘텐츠 생성, 일반 분석, 빠른 처리","대화형 앱, 고속 프로토타이핑, 대규모 일괄 처리, 실시간 응답",1,85,"Gemini 2.5 Flash는 가격과 성능의 최적 균형을 제공하는 Google의 주력 모델이다. 적응형 사고(adaptive thinking) 기능으로 필요에 따라 추론 깊이를 조절할 수 있으며, 대규모 처리, 낮은 지연 시간, 높은 처리량이 필요한 작업에 특화되어 있다. 사고 기능을 선택적으로 활성화할 수 있어 단순한 작업에서는 빠른 응답을, 복잡한 작업에서는 심층적인 분석을 제공한다. 에이전트 기반 사용 사례와 실시간 애플리케이션에 이상적이며, 스타트업이나 개발팀이 빠른 프로토타이핑과 대규모 서비스 구축에 활용하기에 최적의 가성비를 제공한다."
"Midjourney V7","텍스트-이미지-비디오 생성이 통합된 차세대 AI 창작 플랫폼","https://www.midjourney.com","https://www.google.com/s2/favicons?domain=midjourney.com&sz=128","이미지 생성, 비디오 생성, 3D 모델링","마케팅 콘텐츠, 개념 시각화, 브랜드 디자인, 창작 작업",2,92,"Midjourney V7은 2025년 초 출시된 완전히 재구축된 시스템으로, 기존 이미지 생성 능력에 텍스트-비디오 및 3D 모델 생성 기능을 추가했다. 6장의 이미지만으로 60초 길이의 고품질 비디오를 약 3시간 만에 생성할 수 있으며, NeRF와 유사한 3D 형식을 지원한다. 향상된 사실성과 정밀한 프롬프트 해석으로 경쟁 플랫폼 대비 '10배 더 우수'하다고 평가받는다. Midlibrary의 2,500개 Sref 코드로 일관된 스타일 참조가 가능하며, 마케팅, 엔터테인먼트, 컨셉 아트 등 시각적 콘텐츠가 핵심인 산업에서 창작 과정을 혁신적으로 단축시키는 도구다."
"Perplexity Deep Research","자율적으로 수십 개의 검색을 수행하고 종합 보고서를 생성하는 AI 연구 도구","https://www.perplexity.ai","https://www.google.com/s2/favicons?domain=perplexity.ai&sz=128","연구 자동화, 보고서 생성, 정보 분석","시장 조사, 학술 연구, 경쟁 분석, 투자 분석",1,89,"Perplexity Deep Research는 2025년 2월 출시된 자동화된 연구 도구로, 2-4분 만에 전문가 수준의 종합 연구 보고서를 생성한다. 수십 번의 검색과 수백 개의 소스를 읽고 분석하여 금융, 마케팅, 제품 연구 등 전문 분야의 인사이트를 제공한다. Humanity's Last Exam에서 높은 벤치마크를 달성했으며, 무료 사용자도 제한적으로 이용 가능하고 Pro 구독자는 무제한 사용할 수 있다. PDF 내보내기와 Perplexity Page 공유 기능으로 협업이 용이하며, 수시간이 걸리는 연구 작업을 분 단위로 단축시켜 리서치 기반 업무의 생산성을 극적으로 향상시킨다."
"Perplexity AI","실시간 웹 검색과 AI를 결합한 차세대 검색 엔진","https://www.perplexity.ai","https://www.google.com/s2/favicons?domain=perplexity.ai&sz=128","정보 검색, 실시간 분석, 대화형 검색","팩트 체킹, 최신 정보 조회, 경쟁 분석, 뉴스 요약",1,87,"Perplexity AI는 2025년 현재 월 1억 5천만 명의 활성 사용자를 보유한 AI 기반 검색 엔진으로, 전통적인 링크 나열 대신 출처가 명확한 종합적인 답변을 제공한다. 실시간 웹 데이터와 LLM을 결합하여 최신 정보에 대한 정확한 응답을 생성하며, 2025년 7월 출시된 Comet 브라우저로 검색과 브라우징을 통합했다. 음성 어시스턴트, 쇼핑 허브, WhatsApp 통합 등 다양한 기능을 제공하며, Pro 플랜은 GPT-4, Claude 등 고급 모델 접근과 파일 분석 기능을 포함한다. 90억 달러 가치평가를 받으며 Google 검색과 ChatGPT의 주요 경쟁자로 자리잡았다."
"GitHub Copilot","개발자의 기존 IDE에 통합되는 AI 코딩 어시스턴트","https://github.com/features/copilot","https://www.google.com/s2/favicons?domain=github.com&sz=128","코딩 지원, 자동완성, 코드 리뷰","소프트웨어 개발, 코드 리팩토링, API 개발, 디버깅",2,88,"GitHub Copilot은 VS Code, JetBrains, Neovim 등 기존 IDE에 완벽하게 통합되는 AI 코딩 어시스턴트로, 개발자의 워크플로우를 그대로 유지하면서 AI 지원을 추가한다. 실시간 코드 자동완성, 함수 생성, 타입 추론에서 특히 강점을 보이며, 프로덕션 레디 코드 스니펫 생성에 뛰어나다. Copilot Chat을 통한 대화형 코드 리팩토링과 디버깅 지원도 제공한다. 월 10달러부터의 합리적인 가격으로 개별 개발자부터 엔터프라이즈까지 광범위하게 사용되며, 기존 개발 환경을 바꾸지 않고도 AI의 도움을 받고 싶은 개발자들에게 이상적인 선택지다."
"Cursor","AI 우선 설계로 구축된 차세대 코딩 IDE","https://www.cursor.com","https://www.google.com/s2/favicons?domain=cursor.com&sz=128","코딩 지원, IDE, AI 편집","소프트웨어 개발, 프로토타이핑, 코드베이스 분석, 멀티파일 편집",1,91,"Cursor는 VS Code 기반으로 구축되었지만 AI와의 협업을 핵심으로 설계된 완전한 개발 환경이다. 전체 코드베이스의 맥락을 이해하여 멀티파일 편집, 대규모 리팩토링, 복잡한 구조 변경에서 Copilot을 능가하는 성능을 보인다. AI 채팅 패널이 메모리를 유지하여 연속적인 대화가 가능하고, 코드 생성부터 디버깅까지 선언적이고 유지보수가 용이한 솔루션을 제공한다. 월 20달러의 Pro 플랜과 무료 버전을 모두 제공하며, 스타트업과 인디 해커들 사이에서 특히 인기가 높다. AI 기반 개발 워크플로우를 완전히 수용하고자 하는 개발자들에게 가장 진보된 도구로 평가받는다."
"Windsurf","멀티 에이전트 협업이 가능한 AI 코딩 환경","https://codeium.com/windsurf","https://www.google.com/s2/favicons?domain=codeium.com&sz=128","코딩 지원, 멀티에이전트, 웹 IDE","협업 개발, 연구 프로젝트, AI 실험, 원격 개발",1,84,"Windsurf는 웹 기반 IDE로 Claude, GPT-4 등 다양한 AI 모델을 지원하며, 멀티 에이전트 협업 기능을 제공하는 독특한 개발 환경이다. 실시간 편집 공유(Editor Rooms)와 자체 호스팅 옵션을 지원하여 팀 협업과 보안이 중요한 환경에서 강점을 보인다. CLI와 컨테이너를 통한 배포가 가능하고, 연구 목적이나 AI 도구 실험에 적합한 유연성을 제공한다. GitHub Copilot이나 Cursor보다 덜 성숙하지만, 멀티 에이전트 워크플로우와 웹 기반 접근성에서 차별화된다. 분산 팀이나 AI 기반 개발 실험을 진행하는 연구자들에게 흥미로운 대안이 될 수 있다."
"Synthesia","230개 아바타와 140개 언어로 AI 비디오를 생성하는 플랫폼","https://www.synthesia.io","https://www.google.com/s2/favicons?domain=synthesia.io&sz=128","비디오 생성, 아바타 생성, 음성 합성","교육 콘텐츠, 마케팅 비디오, 기업 교육, 다국어 콘텐츠",2,86,"Synthesia는 텍스트 입력만으로 다양한 아바타가 등장하는 전문적인 비디오를 생성하는 선도적인 AI 비디오 플랫폼이다. 230개 이상의 리얼한 아바타와 140개 언어를 지원하여 글로벌 콘텐츠 제작에 특화되어 있다. 기업 교육, 제품 설명, 마케팅 비디오 제작에서 기존의 복잡한 영상 제작 과정을 획기적으로 단순화한다. 100만 명 이상의 사용자가 활용하고 있으며, 전문 장비나 배우 없이도 고품질 비디오 콘텐츠를 빠르게 제작할 수 있다. 특히 다국어 콘텐츠가 필요한 글로벌 기업이나 교육 기관에서 콘텐츠 제작 비용과 시간을 극적으로 줄여주는 핵심 도구다."
"ElevenLabs","자연스러운 AI 음성 생성과 음성 복제 서비스","https://elevenlabs.io","https://www.google.com/s2/favicons?domain=elevenlabs.io&sz=128","음성 생성, 음성 복제, 텍스트-음성","팟캐스트, 오디오북, 내레이션, 다국어 더빙",2,90,"ElevenLabs는 가장 자연스러운 AI 음성 생성 기술을 제공하는 선두 플랫폼으로, 실제 인간의 목소리와 구분하기 어려운 수준의 품질을 달성했다. 개인 목소리 복제, 감정 표현, 다양한 억양과 톤 조절이 가능하며, 29개 언어를 지원한다. 팟캐스트, 오디오북, 교육 콘텐츠, 게임 내레이션 등 다양한 분야에서 활용되고 있다. API를 통한 실시간 음성 생성과 대량 처리도 지원하여 개발자들이 음성 기능을 쉽게 통합할 수 있다. 성우 고용 비용과 시간을 획기적으로 줄여주며, 특히 다국어 콘텐츠나 개인화된 음성이 필요한 프로젝트에서 필수적인 도구로 자리잡고 있다."
"Suno","AI 기반 음악 생성 플랫폼","https://suno.ai","https://www.google.com/s2/favicons?domain=suno.ai&sz=128","음악 생성, 작곡, 오디오 제작","음악 제작, 콘텐츠 BGM, 광고 음악, 창작 지원",1,83,"Suno는 텍스트 프롬프트만으로 완전한 음악을 생성할 수 있는 혁신적인 AI 음악 플랫폼이다. 가사, 멜로디, 편곡, 보컬까지 모든 요소를 자동으로 생성하여 전문적인 음악 제작 지식 없이도 고품질 음악을 만들 수 있다. 다양한 장르와 스타일을 지원하며, 유튜브 콘텐츠, 팟캐스트, 광고 등에 필요한 배경음악을 빠르게 제작할 수 있다. 저작권 이슈 없는 오리지널 음악을 제공하여 콘텐츠 크리에이터들에게 특히 유용하다. 음악 산업의 진입 장벽을 크게 낮추고, 창작자들이 아이디어를 즉시 음악으로 구현할 수 있게 해주는 창작 도구로 평가받는다."
"Gamma","AI 기반 프레젠테이션 자동 생성 도구","https://gamma.app","https://www.google.com/s2/favicons?domain=gamma.app&sz=128","프레젠테이션 생성, 디자인 자동화, 콘텐츠 구성","비즈니스 프레젠테이션, 교육 자료, 제안서, 보고서",1,85,"Gamma는 텍스트 입력만으로 전문적인 프레젠테이션을 자동 생성하는 AI 도구로, 복잡한 디자인 작업 없이도 시각적으로 매력적인 슬라이드를 만들 수 있다. 콘텐츠 구성부터 레이아웃, 색상 배치까지 AI가 자동으로 최적화하여 제작 시간을 획기적으로 단축시킨다. 인터랙티브 요소와 멀티미디어 통합을 지원하며, 웹 기반으로 어디서나 접근 가능하다. 팀 협업 기능과 실시간 편집을 제공하여 여러 명이 동시에 작업할 수 있다. PowerPoint나 Google Slides보다 훨씬 빠르게 전문적인 프레젠테이션을 제작할 수 있어, 비즈니스 전문가와 교육자들에게 시간 절약의 핵심 도구로 활용되고 있다."
"Zapier","7000개 이상의 앱을 연결하는 선도적인 워크플로우 자동화 플랫폼","https://zapier.com","https://www.google.com/s2/favicons?domain=zapier.com&sz=128","워크플로우 자동화, 앱 통합, 비즈니스 자동화","CRM 동기화, 이메일 마케팅, 리드 생성, 데이터 동기화",1,95,"Zapier는 7,000개 이상의 앱을 연결하는 가장 포괄적인 워크플로우 자동화 플랫폼으로, 복잡한 다단계 워크플로우와 조건부 로직을 지원한다. 드래그 앤 드롭 인터페이스로 비개발자도 쉽게 사용할 수 있으며, 웹훅, 고급 필터링, 스케줄링 등 전문가 수준의 기능도 제공한다. Tables와 Interfaces 기능으로 데이터베이스와 사용자 인터페이스까지 생성할 수 있어 완전한 업무 자동화 생태계를 구축할 수 있다. AI 기반 Zap 생성과 최적화 기능으로 설정 과정도 자동화했다. 마케팅, 영업, 고객 서비스, 프로젝트 관리 등 거의 모든 비즈니스 프로세스에서 수작업을 자동화하여 생산성을 극적으로 향상시키는 필수 도구다."
"IFTTT","단순하고 직관적인 'If This Then That' 자동화 서비스","https://ifttt.com","https://www.google.com/s2/favicons?domain=ifttt.com&sz=128","기본 자동화, 스마트홈, IoT 통합","스마트홈 제어, SNS 자동화, 알림 관리, 일상 루틴",1,78,"IFTTT는 'If This Then That' 형식의 단순한 조건부 자동화에 특화된 플랫폼으로, 800개 이상의 서비스를 지원한다. 특히 스마트홈 기기와 IoT 디바이스 통합에서 강점을 보이며, 모바일 앱을 통한 편리한 설정과 관리가 가능하다. 복잡한 비즈니스 로직보다는 개인 사용자의 일상적인 작업 자동화에 최적화되어 있다. AI 프롬프트 빌더와 음성 명령 지원으로 사용 편의성을 높였으며, 무료 플랜으로도 기본적인 자동화가 가능하다. 소셜미디어 자동 게시, 스마트 조명 제어, 위치 기반 알림 등 간단하지만 실용적인 자동화를 원하는 일반 사용자들에게 이상적인 선택이다."
"Make","비주얼 워크플로우 빌더를 제공하는 고급 자동화 플랫폼","https://www.make.com","https://www.google.com/s2/favicons?domain=make.com&sz=128","고급 자동화, 비주얼 워크플로우, API 통합","복잡한 데이터 처리, API 통합, 비즈니스 프로세스 자동화",2,88,"Make(구 Integromat)는 복잡한 자동화 워크플로우를 시각적으로 구성할 수 있는 고급 자동화 플랫폼이다. 분기, 반복, 오류 처리 등 프로그래밍 로직을 GUI로 구현할 수 있어 개발자 수준의 자동화를 노코드로 달성할 수 있다. API 통합과 데이터 변환에서 Zapier보다 더 세밀한 제어가 가능하며, 대용량 데이터 처리와 복잡한 비즈니스 로직 구현에 적합하다. 실시간 실행 모니터링과 디버깅 도구를 제공하여 워크플로우 최적화가 용이하다. 기술적 요구사항이 높은 기업이나 복잡한 시스템 통합이 필요한 프로젝트에서 Zapier의 한계를 넘어서는 고급 자동화 솔루션을 제공한다."
"CloudConvert","200개 이상 포맷을 지원하는 만능 온라인 파일 변환 서비스","https://cloudconvert.com","https://www.google.com/s2/favicons?domain=cloudconvert.com&sz=128","파일 변환, 포맷 변경, 배치 처리","문서 변환, 이미지 처리, 오디오 변환, 비디오 인코딩",1,90,"CloudConvert는 2012년부터 운영되어온 가장 포괄적인 온라인 파일 변환 서비스로, 200개 이상의 파일 포맷 간 변환을 지원한다. ISO 27001 인증으로 데이터 보안을 보장하며, 오픈소스 소프트웨어와 전문 소프트웨어 벤더와의 파트너십으로 최고 품질의 변환 결과를 제공한다. API를 통한 대량 처리와 Amazon S3 통합, 고급 변환 옵션 설정 등 전문가 수준의 기능을 지원한다. 소프트웨어 설치 없이 브라우저에서 즉시 사용 가능하며, 개인 사용자부터 대용량 처리가 필요한 기업까지 광범위하게 활용된다. 파일 형식 호환성 문제로 막혀있던 워크플로우를 즉시 해결해주는 필수 유틸리티다."
"FreeConvert","1500개 이상 파일 변환을 무료로 제공하는 온라인 변환기","https://www.freeconvert.com","https://www.google.com/s2/favicons?domain=freeconvert.com&sz=128","무료 파일 변환, 포맷 지원, 온라인 도구","일반 파일 변환, 이미지 변환, 문서 변환, 미디어 변환",0,82,"FreeConvert는 1500개 이상의 파일 변환을 무료로 제공하는 접근성 높은 온라인 변환 서비스다. Windows, Mac, Linux, 모바일 등 모든 플랫폼에서 브라우저만으로 사용 가능하며, 256비트 SSL 암호화와 자동 파일 삭제로 보안을 보장한다. 고급 옵션을 통해 변환 품질과 설정을 세밀하게 조정할 수 있고, 대기열 없는 빠른 처리를 위한 유료 업그레이드도 제공한다. 강력한 보안 프레임워크와 모니터링 시스템으로 사용자 데이터를 보호한다. 가끔씩 파일 변환이 필요한 일반 사용자나 예산이 제한된 소규모 팀에서 기본적인 파일 변환 요구사항을 충족하는 실용적인 무료 대안이다."
"Remove.bg","원클릭 배경 제거 AI 서비스","https://www.remove.bg","https://www.google.com/s2/favicons?domain=remove.bg&sz=128","이미지 편집, 배경 제거, AI 처리","제품 사진, 프로필 이미지, 마케팅 소재, 디자인 작업",1,91,"Remove.bg는 AI 기술로 이미지의 배경을 자동으로 제거하는 전문 서비스로, 복잡한 이미지 편집 기술 없이도 전문가 수준의 결과를 얻을 수 있다. 사람, 동물, 제품, 자동차 등 다양한 피사체를 정확하게 인식하여 배경을 제거하며, API를 통한 대량 처리도 지원한다. Photoshop이나 다른 이미지 편집 도구와 연동 가능하고, Make, Zapier 등 자동화 플랫폼과도 통합된다. 이커머스 제품 사진, SNS 프로필, 마케팅 소재 제작 등에서 수작업으로 몇 시간 걸릴 작업을 몇 초만에 완료할 수 있다. 디자이너가 아닌 일반인도 전문적인 이미지 편집 결과를 얻을 수 있게 해주는 획기적인 도구다."
"Grammarly","AI 기반 영문 문법 및 글쓰기 개선 도구","https://www.grammarly.com","https://www.google.com/s2/favicons?domain=grammarly.com&sz=128","문법 교정, 글쓰기 지원, 언어 개선","비즈니스 이메일, 학술 글쓰기, 블로그, 소셜미디어",1,89,"Grammarly는 AI를 활용한 최고의 영문 글쓰기 도구로, 문법, 맞춤법, 스타일, 톤까지 종합적으로 개선해준다. 실시간으로 오류를 감지하고 개선 제안을 제공하며, 비즈니스, 학술, 캐주얼 등 다양한 글쓰기 스타일에 맞춘 맞춤형 조언을 한다. 브라우저 확장, 데스크톱 앱, 모바일 앱, Office 통합 등으로 어디서든 사용할 수 있다. 표절 검사, 톤 분석, 명확성 개선 등 고급 기능도 제공한다. 영어로 소통해야 하는 비원어민 사용자들에게는 필수적인 도구이며, 전문적인 영문 커뮤니케이션이 필요한 비즈니스 환경에서 자신감 있는 글쓰기를 가능하게 한다."
"QuillBot","AI 기반 패러프레이징 및 글쓰기 지원 도구","https://quillbot.com","https://www.google.com/s2/favicons?domain=quillbot.com&sz=128","패러프레이징, 요약, 번역","학술 글쓰기, 콘텐츠 제작, 표절 방지, 글 개선",1,84,"QuillBot은 AI 기반 패러프레이징 엔진으로 기존 텍스트를 다양한 스타일과 톤으로 재작성해주는 전문 도구다. 7가지 재작성 모드(Standard, Fluency, Formal, Simple, Creative, Expand, Shorten)를 제공하여 목적에 맞는 글쓰기를 지원한다. 문법 검사, 요약, 번역, 인용 생성 등 종합적인 글쓰기 지원 기능을 하나의 플랫폼에서 제공한다. 학술 논문, 블로그 포스트, 마케팅 콘텐츠 등에서 원본 의미를 유지하면서도 표현을 개선하거나 표절을 피할 수 있게 해준다. 학생, 연구자, 콘텐츠 크리에이터들이 더 나은 글을 더 빠르게 작성할 수 있도록 도와주는 필수 글쓰기 도구다."
"Canva Magic Studio","AI 기능이 통합된 올인원 디자인 플랫폼","https://www.canva.com","https://www.google.com/s2/favicons?domain=canva.com&sz=128","디자인 자동화, 템플릿, AI 이미지 생성","소셜미디어, 프레젠테이션, 마케팅 소재, 브랜딩",1,87,"Canva Magic Studio는 AI 기능이 대폭 강화된 올인원 디자인 플랫폼으로, 전문 디자이너가 아닌 사람도 고품질 시각 콘텐츠를 빠르게 제작할 수 있다. Magic Design으로 텍스트 프롬프트만으로 완성된 디자인을 생성하고, Magic Eraser로 배경 제거, Magic Edit으로 이미지 편집 등 AI 기반 편집 도구를 풍부하게 제공한다. 수백만 개의 템플릿, 이미지, 폰트를 제공하며 팀 협업과 브랜드 일관성 관리도 지원한다. 소셜미디어 포스트, 프레젠테이션, 마케팅 자료, 로고 등 거의 모든 디자인 요구사항을 하나의 플랫폼에서 해결할 수 있어 마케터, 소상공인, 비디자이너들의 필수 도구로 자리잡았다."
